{
  "title": "Customer Onboarding Process",
  "objectives": "Successfully onboard new customers ensuring they have access to all required systems and understand the product basics. By the end of this process, the customer should be able to use the core features independently.",
  "prerequisites": "- Admin access to Customer Portal\n- Access to email system\n- Customer's signed contract\n- Welcome email template",
  "tags": ["onboarding", "customer-success"],
  "steps": [
    {
      "title": "Verify Contract and Customer Details",
      "content": "1. Log into the Customer Portal\n2. Navigate to **Pending Onboardings**\n3. Locate the customer's entry and verify:\n   - Contract is signed and dated\n   - Contact email is valid\n   - Subscription tier matches the contract"
    },
    {
      "title": "Create Customer Account",
      "content": "1. Click **Create Account** in the customer's entry\n2. Fill in the required fields:\n   - Company name\n   - Primary contact email\n   - Subscription tier\n3. Click **Save and Send Invitation**\n\n> Note: The system will automatically send a welcome email with login credentials."
    },
    {
      "title": "Schedule Kickoff Call",
      "content": "1. Send calendar invite to customer's primary contact\n2. Include:\n   - Video conference link\n   - Agenda document\n   - Any pre-call preparation items\n3. Set reminder for 24 hours before the call"
    },
    {
      "title": "Conduct Kickoff and Training",
      "content": "During the kickoff call:\n\n1. Introduce the team\n2. Walk through the product dashboard\n3. Demonstrate core features:\n   - Feature A: Basic usage\n   - Feature B: Configuration options\n   - Feature C: Reporting\n4. Answer questions\n5. Share training resources link"
    },
    {
      "title": "Follow Up and Close Onboarding",
      "content": "Within 48 hours after the kickoff:\n\n1. Send follow-up email with:\n   - Recording of the call (if applicable)\n   - Links to documentation\n   - Support contact information\n2. Update customer status to **Active** in the portal\n3. Schedule 30-day check-in call"
    }
  ]
}
